{
  "schema_version": "matrix-proof-summary.v0",
  "smoke": "schema_example_native_minimal",
  "shell": "carves-matrix",
  "proof_mode": "native_minimal",
  "proof_capabilities": {
    "proof_lane": "native_minimal",
    "execution_backend": "dotnet_runner_chain",
    "coverage": {
      "project_mode": true,
      "packaged_install": false,
      "full_release": false
    },
    "requirements": {
      "powershell": false,
      "source_checkout": false,
      "dotnet_sdk": true,
      "git": true
    }
  },
  "artifact_root": ".",
  "artifact_manifest": {
    "path": "matrix-artifact-manifest.json",
    "schema_version": "matrix-artifact-manifest.v0",
    "sha256": "0000000000000000000000000000000000000000000000000000000000000001",
    "verification_posture": "verified",
    "issue_count": 0
  },
  "trust_chain_hardening": {
    "gates_satisfied": true,
    "computed_by": "matrix_verifier",
    "gates": [
      {
        "gate_id": "manifest_integrity",
        "satisfied": true,
        "reason": "Schema example placeholder for a verified manifest gate.",
        "issue_codes": [],
        "reason_codes": []
      },
      {
        "gate_id": "required_artifacts",
        "satisfied": true,
        "reason": "Schema example placeholder for required artifact metadata.",
        "issue_codes": [],
        "reason_codes": []
      },
      {
        "gate_id": "trial_artifacts",
        "satisfied": true,
        "reason": "Schema example placeholder for Agent Trial artifact posture.",
        "issue_codes": [],
        "reason_codes": []
      },
      {
        "gate_id": "shield_score",
        "satisfied": true,
        "reason": "Schema example placeholder for local Shield score readback.",
        "issue_codes": [],
        "reason_codes": []
      },
      {
        "gate_id": "summary_consistency",
        "satisfied": true,
        "reason": "Schema example placeholder for proof summary consistency.",
        "issue_codes": [],
        "reason_codes": []
      }
    ]
  },
  "native": {
    "passed": true,
    "proof_role": "composition_orchestrator",
    "scoring_owner": "shield",
    "alters_shield_score": false,
    "shield_status": "ok",
    "shield_standard_label": "CARVES G1.H1.A1 /1d PASS",
    "lite_score": 50,
    "consumed_shield_evidence_sha256": "0000000000000000000000000000000000000000000000000000000000000002",
    "guard_decision_artifact": "project/decisions.jsonl",
    "handoff_packet_artifact": "project/handoff.json",
    "consumed_shield_evidence_artifact": "project/shield-evidence.json",
    "shield_evaluation_artifact": "project/shield-evaluate.json",
    "shield_badge_json_artifact": "project/shield-badge.json",
    "shield_badge_svg_artifact": "project/shield-badge.svg",
    "matrix_summary_artifact": "project/matrix-summary.json",
    "artifact_root": "."
  },
  "privacy": {
    "summary_only": true,
    "source_upload_required": false,
    "raw_diff_upload_required": false,
    "prompt_upload_required": false,
    "model_response_upload_required": false,
    "secrets_required": false,
    "hosted_api_required": false
  },
  "public_claims": {
    "certification": false,
    "hosted_verification": false,
    "public_leaderboard": false,
    "os_sandbox_claim": false
  }
}
